{"units": "mm", "cabinet": {"width": 700, "depth": 650, "height": 1850, "wall_thickness": 18}, "door": {"hinge": "right", "window": {"width": 480, "height": 1200, "inset": 30}}, "vents": {"pattern": "louver", "count": 18, "pitch": 14, "slat_height": 6}, "racks": [{"id": 0, "x": 0, "z": 60, "shelves": 4, "shelf_pitch": 360, "shelf_lowest_y": 360, "tray": {"width": 580, "depth": 520, "height": 60}, "led_panel": {"width": 560, "depth": 480, "thickness": 28, "height_above_tray": 280, "ppfd_max": 320}, "fan": {"diameter": 120, "offset_z": -260}, "bezel_radius": 8}], "camera": {"mount_xyz": [-310, 1700, 60], "arm_length": 220, "sensor": "imx708"}, "front_panel": {"lcd": {"width": 98, "height": 24, "x": -120, "y": 1620}, "estop": {"diameter": 40, "x": 140, "y": 1620}}, "composter": {"width": 420, "depth": 380, "height": 340, "position": [-110, 0, 70]}, "reservoirs": {"count": 6, "diameter": 110, "height": 320, "spacing": 130, "row_origin": [180, 0, 80]}, "slurry_tank": {"width": 260, "depth": 240, "height": 420, "position": [-110, 0, 460]}, "clean_water_tank": {"width": 220, "depth": 200, "height": 380, "position": [310, 0, 460]}}
